{
  "$schema": "../Schemas/public_generated_definition_manifest.schema.json",
  "assets": [
    {
      "artifact_path": "Plugins/Resources/ProjectObject/Content/Environment/Hazard/AUDIO_SniperZone.uasset",
      "artifact_sha256": "7c141def8210a7cd9d9b6938389326ff55132c1eb25343f968c2608d57c36fc1",
      "asset_class": "AudioPresetDefinition",
      "package_name": "/ProjectObject/Environment/Hazard/AUDIO_SniperZone",
      "schema_path": "Plugins/Gameplay/ProjectObjectCapabilities/Data/Schemas/audio.schema.json",
      "source_json_hash_md5": "d2ac360fdeed4708b55f7c097479a731",
      "source_path": "Plugins/Resources/ProjectObject/Content/Environment/Hazard/AUDIO_SniperZone.json",
      "source_sha256": "58947e497813fb289a098e253ddce3a044a3fc693d11f3ab36f9c28b6d785c5a"
    },
    {
      "artifact_path": "Plugins/Resources/ProjectObject/Content/Environment/Hazard/GasCloud.uasset",
      "artifact_sha256": "c8abb246a6a20ff4bc970e57edeff5627ea891d81b22e04bc5976d0740e68cde",
      "asset_class": "ObjectDefinition",
      "package_name": "/ProjectObject/Environment/Hazard/GasCloud",
      "schema_path": "Plugins/Resources/ProjectObject/Data/Schemas/object.schema.json",
      "source_json_hash_md5": "aee855fb63a112df6b06be910a02b2fb",
      "source_path": "Plugins/Resources/ProjectObject/Content/Environment/Hazard/GasCloud.json",
      "source_sha256": "9c3b4b43ab83397e2de422f7dfac8f8a3f97d1f33933fd9ac4dd8931b147c48c"
    },
    {
      "artifact_path": "Plugins/Resources/ProjectObject/Content/Environment/Hazard/SniperZone.uasset",
      "artifact_sha256": "10b768132668af69a0d7d7d93279f2ace3734073d1857ba9169adb31d972f450",
      "asset_class": "ObjectDefinition",
      "package_name": "/ProjectObject/Environment/Hazard/SniperZone",
      "schema_path": "Plugins/Resources/ProjectObject/Data/Schemas/object.schema.json",
      "source_json_hash_md5": "a406337bc0f9a1c3cad7012fe5237e20",
      "source_path": "Plugins/Resources/ProjectObject/Content/Environment/Hazard/SniperZone.json",
      "source_sha256": "5e303ec23f684dac58633385f4ddc5cc7cc900bb727fb3bb91f585e1858776ce"
    },
    {
      "artifact_path": "Plugins/Resources/ProjectObject/Content/Human/DeadJunky/Loot_DeadJunky.uasset",
      "artifact_sha256": "aebd361986185634dea1a942c85a3ed3b07b163833e6187d4102f076c09c2dfa",
      "asset_class": "ObjectDefinition",
      "package_name": "/ProjectObject/Human/DeadJunky/Loot_DeadJunky",
      "schema_path": "Plugins/Resources/ProjectObject/Data/Schemas/object.schema.json",
      "source_json_hash_md5": "eb31bbbb4d5bca5ed048def796e7186d",
      "source_path": "Plugins/Resources/ProjectObject/Content/Human/DeadJunky/Loot_DeadJunky.json",
      "source_sha256": "25ab9a23514ea083b057afee9ea1ce1b869e697ad1308eb3fc0ddd25df6163a3"
    },
    {
      "artifact_path": "Plugins/Resources/ProjectObject/Content/Human/GrandPa/DLG_GrandPa_Cigarettes.uasset",
      "artifact_sha256": "68f01425540d57c59f244071c40ae14620be0484c7b708083723624d8330f37d",
      "asset_class": "DialogueTreeDefinition",
      "package_name": "/ProjectObject/Human/GrandPa/DLG_GrandPa_Cigarettes",
      "schema_path": "Plugins/Features/ProjectDialogue/Data/Schemas/dialogue.schema.json",
      "source_json_hash_md5": "1a6482d91c9169f4c1c46c7b04b8c4c4",
      "source_path": "Plugins/Resources/ProjectObject/Content/Human/GrandPa/DLG_GrandPa_Cigarettes.json",
      "source_sha256": "2e1361281ae749e7aad637cdd4401773abe58beb506b5a4c10157f6f48b4a2c4"
    },
    {
      "artifact_path": "Plugins/Resources/ProjectObject/Content/Human/GrandPa/DLG_GrandPa_Entry.uasset",
      "artifact_sha256": "e95bd31cfd9eb4de65928ea6bb5a6fff529f9cc96a18118ff2e643425e46ba23",
      "asset_class": "DialogueTreeDefinition",
      "package_name": "/ProjectObject/Human/GrandPa/DLG_GrandPa_Entry",
      "schema_path": "Plugins/Features/ProjectDialogue/Data/Schemas/dialogue.schema.json",
      "source_json_hash_md5": "f1f35bb51375d25f272869855dffdbe7",
      "source_path": "Plugins/Resources/ProjectObject/Content/Human/GrandPa/DLG_GrandPa_Entry.json",
      "source_sha256": "aa96f6b8b9ecc64506f6a39e57dd3130bdbf838a105280355cf8dbf8669b8ae5"
    },
    {
      "artifact_path": "Plugins/Resources/ProjectObject/Content/Human/GrandPa/DLG_GrandPa_FamilyApartment.uasset",
      "artifact_sha256": "437f18f5e9e52727d10c6f5a148ec847b92269cd602de8f733cf9383220cdf2e",
      "asset_class": "DialogueTreeDefinition",
      "package_name": "/ProjectObject/Human/GrandPa/DLG_GrandPa_FamilyApartment",
      "schema_path": "Plugins/Features/ProjectDialogue/Data/Schemas/dialogue.schema.json",
      "source_json_hash_md5": "dd8a9559f210838c6418bc68765b5c43",
      "source_path": "Plugins/Resources/ProjectObject/Content/Human/GrandPa/DLG_GrandPa_FamilyApartment.json",
      "source_sha256": "73672694f96ed07b66eca55c7239924b5ed471a7e4ae99ce33f8422dd4bb2b66"
    },
    {
      "artifact_path": "Plugins/Resources/ProjectObject/Content/Human/GrandPa/DLG_GrandPa_Inside.uasset",
      "artifact_sha256": "8fff2c1bd3eb7edbe10ba402318588b1f2c89cb3b39fbd3e3a4156f0c3478e8f",
      "asset_class": "DialogueTreeDefinition",
      "package_name": "/ProjectObject/Human/GrandPa/DLG_GrandPa_Inside",
      "schema_path": "Plugins/Features/ProjectDialogue/Data/Schemas/dialogue.schema.json",
      "source_json_hash_md5": "2d32d8ae192f39fe449ec791ad30236c",
      "source_path": "Plugins/Resources/ProjectObject/Content/Human/GrandPa/DLG_GrandPa_Inside.json",
      "source_sha256": "d2c9181d24f208f58a63e478dfcf8a8b60b6a35a7806f4002a79f074ed16eb41"
    },
    {
      "artifact_path": "Plugins/Resources/ProjectObject/Content/Human/GrandPa/GrandPa.uasset",
      "artifact_sha256": "df6c3dde898be030e827e38c95dc0df7b06fa7428bea8aa93e397881ebff4b7b",
      "asset_class": "ObjectDefinition",
      "package_name": "/ProjectObject/Human/GrandPa/GrandPa",
      "schema_path": "Plugins/Resources/ProjectObject/Data/Schemas/object.schema.json",
      "source_json_hash_md5": "06782d4605aec77823e2a28d9d02644d",
      "source_path": "Plugins/Resources/ProjectObject/Content/Human/GrandPa/GrandPa.json",
      "source_sha256": "ee90cd9cf49589aa24604a8d6fe8fb08c3ad9529ccd3fefb17c67e51b716714f"
    },
    {
      "artifact_path": "Plugins/Resources/ProjectObject/Content/Human/Hero/Hero.uasset",
      "artifact_sha256": "5cd199e3bf8db7c8173344a9208d80b1a768aa10b0d945508fd3f961c3260b4b",
      "asset_class": "ObjectDefinition",
      "package_name": "/ProjectObject/Human/Hero/Hero",
      "schema_path": "Plugins/Resources/ProjectObject/Data/Schemas/object.schema.json",
      "source_json_hash_md5": "32faf58117dcd3b06f6d144b6481dca3",
      "source_path": "Plugins/Resources/ProjectObject/Content/Human/Hero/Hero.json",
      "source_sha256": "69d5807a0a454af5795ce9dc84df977844b824527905e373029d7ca6ae938958"
    },
    {
      "artifact_path": "Plugins/Resources/ProjectObject/Content/HumanMade/Building/EngineeringSystem/ElectricalInfrastructure/DistributionPanel/ElectricPanel_Entrance.uasset",
      "artifact_sha256": "ee39a75b460a0e6b83aef0f3ee22f2ee07614e2787268e6540a42a31ccaeee3a",
      "asset_class": "ObjectDefinition",
      "package_name": "/ProjectObject/HumanMade/Building/EngineeringSystem/ElectricalInfrastructure/DistributionPanel/ElectricPanel_Entrance",
      "schema_path": "Plugins/Resources/ProjectObject/Data/Schemas/object.schema.json",
      "source_json_hash_md5": "0ee04bfe75a7f42f91cda68dbc6d3e18",
      "source_path": "Plugins/Resources/ProjectObject/Content/HumanMade/Building/EngineeringSystem/ElectricalInfrastructure/DistributionPanel/ElectricPanel_Entrance.json",
      "source_sha256": "4ad792781b890cda017ed99874288f444f6c2675261ab407c7673c85d9c53270"
    },
    {
      "artifact_path": "Plugins/Resources/ProjectObject/Content/HumanMade/Building/Fenestration/Door/Accessory/Key/KeyLuxuryApartment.uasset",
      "artifact_sha256": "c57fca67be8e6d5094d9161bb96770b0db957bc2985a72685154e32578258c38",
      "asset_class": "ObjectDefinition",
      "package_name": "/ProjectObject/HumanMade/Building/Fenestration/Door/Accessory/Key/KeyLuxuryApartment",
      "schema_path": "Plugins/Resources/ProjectObject/Data/Schemas/object.schema.json",
      "source_json_hash_md5": "e8eedbeb963f599aa914a759d64273d1",
      "source_path": "Plugins/Resources/ProjectObject/Content/HumanMade/Building/Fenestration/Door/Accessory/Key/KeyLuxuryApartment.json",
      "source_sha256": "dff82eaba8f8cb3ac3de659e5a03f7805dbf7bc69256a5133865e88b26c753cf"
    },
    {
      "artifact_path": "Plugins/Resources/ProjectObject/Content/HumanMade/Building/Fenestration/Door/Accessory/Key/KeyPlayerApartment.uasset",
      "artifact_sha256": "bad307c0a51e62c98b38ce6fd9392be765e00022586bb875dc103fe055cae0ef",
      "asset_class": "ObjectDefinition",
      "package_name": "/ProjectObject/HumanMade/Building/Fenestration/Door/Accessory/Key/KeyPlayerApartment",
      "schema_path": "Plugins/Resources/ProjectObject/Data/Schemas/object.schema.json",
      "source_json_hash_md5": "44371345e38ad6bfc6a32a095d2a4f5d",
      "source_path": "Plugins/Resources/ProjectObject/Content/HumanMade/Building/Fenestration/Door/Accessory/Key/KeyPlayerApartment.json",
      "source_sha256": "61613edd5c2ca18c9a207026c819ae449b86c504d37e7617d383bd5627fde22e"
    },
    {
      "artifact_path": "Plugins/Resources/ProjectObject/Content/HumanMade/Building/Fenestration/Door/Indoor/Inner/Complex/ComplexDoor_Inner_1/ComplexDoor_Inner_Beige.uasset",
      "artifact_sha256": "dc79609fe788fd03384627a5fe0a8d5d5de62e2facfb61d031110feabd2f8eac",
      "asset_class": "ObjectDefinition",
      "package_name": "/ProjectObject/HumanMade/Building/Fenestration/Door/Indoor/Inner/Complex/ComplexDoor_Inner_1/ComplexDoor_Inner_Beige",
      "schema_path": "Plugins/Resources/ProjectObject/Data/Schemas/object.schema.json",
      "source_json_hash_md5": "81bf2ea3b6103ef22a1b2c509520b6b5",